{
 "generated_utc": "2026-10-27T13:03:30Z",
 "players": [
  {
   "air_yards": 397.0,
   "id": "00-0033280",
   "name": "C.McCaffrey",
   "rush_att": 337,
   "rz_touches": 52,
   "target_share": 0.234,
   "targets": 143,
   "team": "SF"
  },
  {
   "air_yards": 57.0,
   "id": "00-0037248",
   "name": "J.Cook",
   "rush_att": 348,
   "rz_touches": 30,
   "target_share": 0.0819,
   "targets": 46,
   "team": "BUF"
  },
  {
   "air_yards": 101.0,
   "id": "00-0038542",
   "name": "B.Robinson",
   "rush_att": 288,
   "rz_touches": 22,
   "target_share": 0.1973,
   "targets": 103,
   "team": "ATL"
  },
  {
   "air_yards": -45.0,
   "id": "00-0036223",
   "name": "J.Taylor",
   "rush_att": 324,
   "rz_touches": 42,
   "target_share": 0.1045,
   "targets": 56,
   "team": "IND"
  },
  {
   "air_yards": 32.0,
   "id": "00-0034844",
   "name": "S.Barkley",
   "rush_att": 307,
   "rz_touches": 33,
   "target_share": 0.114,
   "targets": 57,
   "team": "PHI"
  },
  {
   "air_yards": 163.0,
   "id": "00-0037840",
   "name": "K.Williams",
   "rush_att": 303,
   "rz_touches": 39,
   "target_share": 0.0846,
   "targets": 59,
   "team": "LAR"
  },
  {
   "air_yards": -104.0,
   "id": "00-0040122",
   "name": "A.Jeanty",
   "rush_att": 267,
   "rz_touches": 20,
   "target_share": 0.1472,
   "targets": 73,
   "team": "LV"
  },
  {
   "air_yards": 54.0,
   "id": "00-0039139",
   "name": "J.Gibbs",
   "rush_att": 243,
   "rz_touches": 26,
   "target_share": 0.1709,
   "targets": 94,
   "team": "DET"
  },
  {
   "air_yards": -36.0,
   "id": "00-0038134",
   "name": "K.Walker",
   "rush_att": 286,
   "rz_touches": 18,
   "target_share": 0.0866,
   "targets": 47,
   "team": "SEA"
  },
  {
   "air_yards": 12.0,
   "id": "00-0032764",
   "name": "D.Henry",
   "rush_att": 307,
   "rz_touches": 40,
   "target_share": 0.0513,
   "targets": 21,
   "team": "BAL"
  },
  {
   "air_yards": -69.0,
   "id": "00-0036973",
   "name": "T.Etienne",
   "rush_att": 270,
   "rz_touches": 32,
   "target_share": 0.0984,
   "targets": 57,
   "team": "JAX"
  },
  {
   "air_yards": 35.0,
   "id": "00-0039040",
   "name": "D.Achane",
   "rush_att": 238,
   "rz_touches": 16,
   "target_share": 0.1828,
   "targets": 85,
   "team": "MIA"
  },
  {
   "air_yards": 46.0,
   "id": "00-0038597",
   "name": "C.Brown",
   "rush_att": 233,
   "rz_touches": 26,
   "target_share": 0.1457,
   "targets": 89,
   "team": "CIN"
  },
  {
   "air_yards": -21.0,
   "id": "00-0036275",
   "name": "D.Swift",
   "rush_att": 255,
   "rz_touches": 29,
   "target_share": 0.08,
   "targets": 50,
   "team": "CHI"
  },
  {
   "air_yards": -67.0,
   "id": "00-0036997",
   "name": "J.Williams",
   "rush_att": 252,
   "rz_touches": 33,
   "target_share": 0.0836,
   "targets": 51,
   "team": "DAL"
  },
  {
   "air_yards": -27.0,
   "id": "00-0035700",
   "name": "J.Jacobs",
   "rush_att": 253,
   "rz_touches": 34,
   "target_share": 0.094,
   "targets": 47,
   "team": "GB"
  },
  {
   "air_yards": -48.0,
   "id": "00-0036139",
   "name": "R.Dowdle",
   "rush_att": 242,
   "rz_touches": 15,
   "target_share": 0.1002,
   "targets": 52,
   "team": "CAR"
  },
  {
   "air_yards": 14.0,
   "id": "00-0038120",
   "name": "B.Hall",
   "rush_att": 243,
   "rz_touches": 13,
   "target_share": 0.1006,
   "targets": 48,
   "team": "NYJ"
  },
  {
   "air_yards": 12.0,
   "id": "00-0035261",
   "name": "T.Pollard",
   "rush_att": 242,
   "rz_touches": 12,
   "target_share": 0.0774,
   "targets": 41,
   "team": "TEN"
  },
  {
   "air_yards": 89.0,
   "id": "00-0040583",
   "name": "W.Marks",
   "rush_att": 229,
   "rz_touches": 22,
   "target_share": 0.0631,
   "targets": 40,
   "team": "HOU"
  },
  {
   "air_yards": -109.0,
   "id": "00-0037228",
   "name": "J.Warren",
   "rush_att": 223,
   "rz_touches": 27,
   "target_share": 0.0829,
   "targets": 46,
   "team": "PIT"
  },
  {
   "air_yards": -15.0,
   "id": "00-0040784",
   "name": "Q.Judkins",
   "rush_att": 231,
   "rz_touches": 19,
   "target_share": 0.0687,
   "targets": 36,
   "team": "CLE"
  },
  {
   "air_yards": -14.0,
   "id": "00-0040734",
   "name": "T.Henderson",
   "rush_att": 210,
   "rz_touches": 24,
   "target_share": 0.0803,
   "targets": 48,
   "team": "NE"
  },
  {
   "air_yards": 168.0,
   "id": "00-0036875",
   "name": "R.Stevenson",
   "rush_att": 189,
   "rz_touches": 22,
   "target_share": 0.0886,
   "targets": 53,
   "team": "NE"
  },
  {
   "air_yards": 58.0,
   "id": "00-0040730",
   "name": "R.Harvey",
   "rush_att": 166,
   "rz_touches": 21,
   "target_share": 0.1064,
   "targets": 70,
   "team": "DEN"
  },
  {
   "air_yards": 6.0,
   "id": "00-0040236",
   "name": "K.Monangai",
   "rush_att": 192,
   "rz_touches": 26,
   "target_share": 0.0592,
   "targets": 37,
   "team": "CHI"
  },
  {
   "air_yards": 2101.0,
   "id": "00-0039075",
   "name": "P.Nacua",
   "rush_att": 16,
   "rz_touches": 13,
   "target_share": 0.2984,
   "targets": 208,
   "team": "LAR"
  },
  {
   "air_yards": 19.0,
   "id": "00-0039384",
   "name": "T.Tracy",
   "rush_att": 176,
   "rz_touches": 7,
   "target_share": 0.0949,
   "targets": 48,
   "team": "NYG"
  },
  {
   "air_yards": 40.0,
   "id": "00-0039165",
   "name": "Z.Charbonnet",
   "rush_att": 190,
   "rz_touches": 33,
   "target_share": 0.0442,
   "targets": 24,
   "team": "SEA"
  },
  {
   "air_yards": -10.0,
   "id": "00-0036919",
   "name": "K.Gainwell",
   "rush_att": 120,
   "rz_touches": 22,
   "target_share": 0.164,
   "targets": 91,
   "team": "PIT"
  },
  {
   "air_yards": -56.0,
   "id": "00-0039361",
   "name": "B.Irving",
   "rush_att": 173,
   "rz_touches": 7,
   "target_share": 0.0642,
   "targets": 35,
   "team": "TB"
  },
  {
   "air_yards": 2095.0,
   "id": "00-0038543",
   "name": "J.Smith-Njigba",
   "rush_att": 7,
   "rz_touches": 8,
   "target_share": 0.3481,
   "targets": 189,
   "team": "SEA"
  },
  {
   "air_yards": -42.0,
   "id": "00-0036555",
   "name": "C.Hubbard",
   "rush_att": 148,
   "rz_touches": 14,
   "target_share": 0.0829,
   "targets": 43,
   "team": "CAR"
  },
  {
   "air_yards": 15.0,
   "id": "00-0039391",
   "name": "K.Vidal",
   "rush_att": 166,
   "rz_touches": 15,
   "target_share": 0.0436,
   "targets": 25,
   "team": "LAC"
  },
  {
   "air_yards": 38.0,
   "id": "00-0039738",
   "name": "B.Corum",
   "rush_att": 171,
   "rz_touches": 16,
   "target_share": 0.0273,
   "targets": 19,
   "team": "LAR"
  },
  {
   "air_yards": -19.0,
   "id": "00-0040242",
   "name": "J.Croskey-Merritt",
   "rush_att": 176,
   "rz_touches": 21,
   "target_share": 0.0298,
   "targets": 13,
   "team": "WAS"
  },
  {
   "air_yards": 1570.0,
   "id": "00-0036900",
   "name": "J.Chase",
   "rush_att": 3,
   "rz_touches": 8,
   "target_share": 0.3028,
   "targets": 185,
   "team": "CIN"
  },
  {
   "air_yards": 12.0,
   "id": "00-0035685",
   "name": "D.Montgomery",
   "rush_att": 159,
   "rz_touches": 25,
   "target_share": 0.0527,
   "targets": 29,
   "team": "DET"
  },
  {
   "air_yards": 0.0,
   "id": "00-0033923",
   "name": "K.Hunt",
   "rush_att": 163,
   "rz_touches": 22,
   "target_share": 0.0453,
   "targets": 25,
   "team": "KC"
  },
  {
   "air_yards": -102.0,
   "id": "00-0037256",
   "name": "R.White",
   "rush_att": 133,
   "rz_touches": 11,
   "target_share": 0.0826,
   "targets": 45,
   "team": "TB"
  },
  {
   "air_yards": 1390.0,
   "id": "00-0036963",
   "name": "A.St. Brown",
   "rush_att": 3,
   "rz_touches": 21,
   "target_share": 0.3127,
   "targets": 172,
   "team": "DET"
  },
  {
   "air_yards": -52.0,
   "id": "00-0037525",
   "name": "J.Mason",
   "rush_att": 159,
   "rz_touches": 9,
   "target_share": 0.0339,
   "targets": 16,
   "team": "MIN"
  },
  {
   "air_yards": -25.0,
   "id": "00-0033293",
   "name": "A.Jones",
   "rush_att": 132,
   "rz_touches": 6,
   "target_share": 0.0869,
   "targets": 41,
   "team": "MIN"
  },
  {
   "air_yards": 1126.0,
   "id": "00-0037744",
   "name": "T.McBride",
   "rush_att": 0,
   "rz_touches": 12,
   "target_share": 0.2742,
   "targets": 170,
   "team": "ARI"
  },
  {
   "air_yards": 33.0,
   "id": "00-0033906",
   "name": "A.Kamara",
   "rush_att": 131,
   "rz_touches": 8,
   "target_share": 0.0689,
   "targets": 39,
   "team": "NO"
  },
  {
   "air_yards": -30.0,
   "id": "00-0036158",
   "name": "J.Dobbins",
   "rush_att": 153,
   "rz_touches": 11,
   "target_share": 0.0213,
   "targets": 14,
   "team": "DEN"
  },
  {
   "air_yards": -54.0,
   "id": "00-0040666",
   "name": "O.Hampton",
   "rush_att": 125,
   "rz_touches": 16,
   "target_share": 0.061,
   "targets": 35,
   "team": "LAC"
  },
  {
   "air_yards": -26.0,
   "id": "00-0037263",
   "name": "T.Allgeier",
   "rush_att": 143,
   "rz_touches": 19,
   "target_share": 0.0307,
   "targets": 16,
   "team": "ATL"
  },
  {
   "air_yards": 1841.0,
   "id": "00-0037239",
   "name": "C.Olave",
   "rush_att": 1,
   "rz_touches": 4,
   "target_share": 0.2756,
   "targets": 156,
   "team": "NO"
  },
  {
   "air_yards": 24.0,
   "id": "00-0034791",
   "name": "N.Chubb",
   "rush_att": 136,
   "rz_touches": 6,
   "target_share": 0.0331,
   "targets": 21,
   "team": "HOU"
  },
  {
   "air_yards": -32.0,
   "id": "00-0038797",
   "name": "E.Wilson",
   "rush_att": 126,
   "rz_touches": 10,
   "target_share": 0.036,
   "targets": 18,
   "team": "GB"
  },
  {
   "air_yards": -27.0,
   "id": "00-0037197",
   "name": "I.Pacheco",
   "rush_att": 118,
   "rz_touches": 9,
   "target_share": 0.0471,
   "targets": 26,
   "team": "KC"
  },
  {
   "air_yards": 1438.0,
   "id": "00-0036322",
   "name": "J.Jefferson",
   "rush_att": 2,
   "rz_touches": 11,
   "target_share": 0.3008,
   "targets": 142,
   "team": "MIN"
  },
  {
   "air_yards": 1187.0,
   "id": "00-0038117",
   "name": "W.Robinson",
   "rush_att": 3,
   "rz_touches": 6,
   "target_share": 0.2787,
   "targets": 141,
   "team": "NYG"
  },
  {
   "air_yards": 1832.0,
   "id": "00-0031381",
   "name": "D.Adams",
   "rush_att": 0,
   "rz_touches": 24,
   "target_share": 0.1994,
   "targets": 139,